{
  "claims": [
    {
      "claim_id": "claim:2ee123f58086aa52",
      "evidence_card_ids": [
        "evidence_card:887d7bcaa96d5497"
      ],
      "evidence_status": "supported",
      "scope": "sdir_graph_reasoning",
      "strength": "weak",
      "text": "Scene Graph Transformers reports a limitation or cost signal relevant to targeted gap analysis."
    },
    {
      "claim_id": "claim:89bfef6fd4688576",
      "evidence_card_ids": [
        "evidence_card:c39e0573d1607454"
      ],
      "evidence_status": "supported",
      "scope": "sdir_graph_reasoning",
      "strength": "weak",
      "text": "Scene Graph Transformers reports a limitation or cost signal relevant to targeted gap analysis."
    },
    {
      "claim_id": "claim:5ea16746d83744cb",
      "evidence_card_ids": [
        "evidence_card:ce539c1f63b79c40"
      ],
      "evidence_status": "supported",
      "scope": "sdir_graph_reasoning",
      "strength": "weak",
      "text": "Graph Diffusion Planning reports a benchmark or evaluation signal relevant to this subdirection."
    },
    {
      "claim_id": "claim:6da2f0c29c9cdb5f",
      "evidence_card_ids": [
        "evidence_card:e388eab2ca704ebe"
      ],
      "evidence_status": "supported",
      "scope": "sdir_graph_reasoning",
      "strength": "weak",
      "text": "Graph Diffusion Planning reports a limitation or cost signal relevant to targeted gap analysis."
    }
  ],
  "created_at": "2026-04-27T03:52:57Z",
  "edges": [],
  "input_hash": "sha256:b59f3b7bf1a361f6781fa220672d90cd1a7ce14d4bf9d39c1125d1fae1d6a09c",
  "parent_state_ids": [
    "evidence_card:887d7bcaa96d5497",
    "evidence_card:c39e0573d1607454",
    "evidence_card:ce539c1f63b79c40",
    "evidence_card:e388eab2ca704ebe"
  ],
  "producer": {
    "name": "resmax_survey_v2.phase3_pack",
    "run_id": "phase3",
    "version": "0.1.0"
  },
  "schema_version": "0.1.0",
  "state_id": "claim_graph:b59f3b7bf1a361f6"
}
