{
  "schema_version": "0.1.0",
  "state_id": "claim_graph:77777777",
  "created_at": "2026-04-27T00:06:00Z",
  "input_hash": "sha256:7777777777777777777777777777777777777777777777777777777777777777",
  "parent_state_ids": ["evidence_card:66666666"],
  "producer": {"name": "phase0-fixture", "version": "0.1.0", "run_id": "fixture"},
  "claims": [
    {
      "claim_id": "claim-1",
      "text": "Benchmark blind spots can motivate a low-cost research direction.",
      "strength": "strong",
      "evidence_status": "supported",
      "evidence_card_ids": ["evidence_card:66666666"]
    },
    {
      "claim_id": "claim-2",
      "text": "The exact publication upside is not established by the fixture.",
      "strength": "strong",
      "evidence_status": "insufficient_evidence",
      "evidence_card_ids": []
    }
  ],
  "edges": [
    {"source_claim_id": "claim-1", "target_claim_id": "claim-2", "relation": "motivates"}
  ]
}
